{
  "schemaVersion": "1.0",
  "chainId": 42161,
  "roots": [
    {
      "role": "morpho",
      "address": "0x6c247b1F6182318877311737BaC0844bAa518F5e",
      "codeHash": "0xd2bb64e51bc71ff5ce00ae89eab643e65fda6fc59f4ab8c367241c4bedf8acf5",
      "source": "https://docs.morpho.org/get-started/resources/addresses"
    },
    {
      "role": "balancer-v2",
      "address": "0xBA12222222228d8Ba445958a75a0704d566BF2C8",
      "codeHash": "0x96f131af73d8a231741b91e266fb54e0bc8c3041954deb51652113600549093a",
      "source": "https://docs.balancer.fi/reference/contracts/deployment-addresses/arbitrum.html"
    },
    {
      "role": "aave-provider",
      "address": "0xa97684ead0e402dC232d5A977953DF7ECBaB3CDb",
      "codeHash": "0x1a95f317ee56e0b9aedc4f4b7abd9e546dc45c26d1d77e95bcf62b789d9a5486",
      "source": "https://github.com/bgd-labs/aave-address-book/blob/main/src/AaveV3Arbitrum.sol"
    },
    {
      "role": "v2-factory",
      "address": "0xf1D7CC64Fb4452F05c498126312eBE29f30Fbcf9",
      "codeHash": "0xbab145d02e7005f0d84c6c1639d39b799b0ea16df99ebbdaf5a14d9da820b4e0",
      "source": "https://docs.uniswap.org/contracts/v2/reference/smart-contracts/v2-deployments"
    },
    {
      "role": "v2-factory",
      "address": "0xc35DADB65012eC5796536bD9864eD8773aBc74C4",
      "codeHash": "0xeba2e349904f5b2c1f6086ffb00d5c7efb4a2c8ea8af2efccfd1c812c7869b6c",
      "source": "https://docs.sushi.com/contracts/cpamm"
    },
    {
      "role": "v3-factory",
      "address": "0x1F98431c8aD98523631AE4a59f267346ea31F984",
      "codeHash": "0x4d7b8525cd5d14343fa67a732fba5b24cddba11620ca88392f4ec6c52f91fd69",
      "source": "https://docs.uniswap.org/contracts/v3/reference/deployments/arbitrum-deployments"
    },
    {
      "role": "v3-factory",
      "address": "0x1af415a1EbA07a4986a52B6f2e7dE7003D82231e",
      "codeHash": "0x1322b4f72cb500ce9148934db841b68577e4ab05740d75767786a054047ae2e0",
      "source": "https://docs.sushi.com/contracts/clamm"
    },
    {
      "role": "v3-factory",
      "address": "0x0BFbCF9fa4f9C56B0F40a671Ad40E0805A091865",
      "codeHash": "0x8191d3ab1d55d3da9822199f28865415c99566b6f1aee4a4b16713f57930678c",
      "source": "https://developer.pancakeswap.finance/contracts/v3/addresses"
    },
    {
      "role": "algebra-factory",
      "address": "0x1a3c9B1d2F0529D97f2afC5136Cc23e58f1FD35B",
      "codeHash": "0xd2e121b20e1ffe21cebd67e884032884c11425315d7d0f746673b246371558d3",
      "source": "https://docs.camelot.exchange/contracts/arbitrum-one-mainnet"
    },
    {
      "role": "v4-manager",
      "address": "0x360E68faCcca8cA495c1B759Fd9EEe466db9FB32",
      "codeHash": "0xe4b2759e456c9c4ef763e3b4e257c5105e1ba283d7de8b131dd321197de794a4",
      "source": "https://docs.uniswap.org/contracts/v4/deployments"
    }
  ],
  "contracts": [
    "MultiVenueArbitrageExecutor"
  ],
  "exclusions": [
    {
      "contract": "ArbitrumMultiSplitFlashExecutor",
      "reason": "Historical Arbitrum constants; MultiVenue routes by pinned factory roots and pool addresses"
    }
  ]
}
